Company,Job Title,Location,Job Type,Experience,Skill 1,Skill 2,Skill 3,Skill 4,Skill 5,Skill 6,Perk 1,Perk 2,Perk 3,Perk 4,Perk 5,Perk 6,Required Skills,all_perks,tags
Zscaler,Data Science Intern- Undergrad (Summer 2023),"San Jose, CA, United States",Internship,Entry-level,Agile,Architecture,Data analysis,Data Analytics,Data strategy,Data visualization,Competitive pay,Equity,Health care,,,,"Agile, Architecture, Data analysis, Data Analytics, Data strategy, Data visualization","Competitive pay, Equity, Health care","data science intern- undergrad (summer 2023) agile, architecture, data analysis, data analytics, data strategy, data visualization"
RYTE Corporation,R&D Data Scientist Intern (Alternance),"Nice, Provence-Alpes-Côte d'Azur, France",Internship,Entry-level,Big Data,Computer Science,Deep Learning,Engineering,Keras,Python,Career development,Flex vacation,,,,,"Big Data, Computer Science, Deep Learning, Engineering, Keras, Python","Career development, Flex vacation","r&d data scientist intern (alternance) big data, computer science, deep learning, engineering, keras, python"
SOMFY Group,Alternance Data Analyst (H/F),"Cluses, France",Full Time,Entry-level,Data analysis,Excel,Power BI,Python,R,R&D,Salary bonus,,,,,,"Data analysis, Excel, Power BI, Python, R, R&D",Salary bonus,"alternance data analyst (h/f) data analysis, excel, power bi, python, r, r&d"
RYTE Corporation,MLOps Engineer Intern (Alternance),"Nice, Provence-Alpes-Côte d'Azur, France",Internship,Entry-level,Azure,Big Data,CI/CD,Computer Science,Databricks,Deep Learning,Career development,,,,,,"Azure, Big Data, CI/CD, Computer Science, Databricks, Deep Learning",Career development,"mlops engineer intern (alternance) azure, big data, ci/cd, computer science, databricks, deep learning"
RYTE Corporation,Data Scientist (NLP & ML) Intern (Alternance),"Nice, Provence-Alpes-Côte d'Azur, France",Internship,Entry-level,Azure,Big Data,C++,Computer Science,Deep Learning,Docker,Career development,,,,,,"Azure, Big Data, C++, Computer Science, Deep Learning, Docker",Career development,"data scientist (nlp & ml) intern (alternance) azure, big data, c++, computer science, deep learning, docker"
Shadow,Data Analyst / Data Scientist Intern (H/F/X) - July 2023,Paris,Internship,Entry-level,Agile,Clustering,Data analysis,Data visualization,KPIs,Pandas,Career development,Flex hours,Flex vacation,,,,"Agile, Clustering, Data analysis, Data visualization, KPIs, Pandas","Career development, Flex hours, Flex vacation","data analyst / data scientist intern (h/f/x) - july 2023 agile, clustering, data analysis, data visualization, kpis, pandas"
Zuora,Data Science Intern,"Redwood City, California, United States",Internship,Entry-level,Avro,AWS,Computer Science,CSV,DynamoDB,Finance,Career development,Competitive pay,Health care,,,,"Avro, AWS, Computer Science, CSV, DynamoDB, Finance","Career development, Competitive pay, Health care","data science intern avro, aws, computer science, csv, dynamodb, finance"
Shippeo,Data Scientist - Internship,"Paris, France",Internship,Entry-level,A/B testing,Engineering,Machine Learning,ML models,MLOps,Model design,,,,,,,"A/B testing, Engineering, Machine Learning, ML models, MLOps, Model design",,"data scientist - internship a/b testing, engineering, machine learning, ml models, mlops, model design"
"6sense Insights, Inc.",Data Scientist Intern,"United States, Remote",Internship,Entry-level,APIs,Big Data,Business Analytics,Data analysis,Data Analytics,Data visualization,Career development,Gear,Health care,,,,"APIs, Big Data, Business Analytics, Data analysis, Data Analytics, Data visualization","Career development, Gear, Health care","data scientist intern apis, big data, business analytics, data analysis, data analytics, data visualization"
Chime,Data Analytics Intern,"San Francisco, CA",Internship,Entry-level,Banking,Data Analytics,Data visualization,Distributed Systems,Economics,FinTech,401(k) matching,Career development,Competitive pay,,,,"Banking, Data Analytics, Data visualization, Distributed Systems, Economics, FinTech","401(k) matching, Career development, Competitive pay","data analytics intern banking, data analytics, data visualization, distributed systems, economics, fintech"
Shippeo,INTERNSHIP: IT Project Manager - Data Integration (M/F/D),"Paris, France",Internship,Entry-level,Agile,Engineering,KPIs,,,,,,,,,,"Agile, Engineering, KPIs",,"internship: it project manager - data integration (m/f/d) agile, engineering, kpis"
Lacework,Analytics Engineer Intern,United States,Internship,Entry-level,BigQuery,Computer Science,Data analysis,Data warehouse,Engineering,Finance,,,,,,,"BigQuery, Computer Science, Data analysis, Data warehouse, Engineering, Finance",,"analytics engineer intern bigquery, computer science, data analysis, data warehouse, engineering, finance"
Illumio,"Data Analyst Intern, Business Intelligence","Sunnyvale, California",Internship,Entry-level,Business Intelligence,Data governance,Excel,Security,SQL,,Equity,,,,,,"Business Intelligence, Data governance, Excel, Security, SQL",Equity,"data analyst intern, business intelligence business intelligence, data governance, excel, security, sql"
Amazon.com,Applied Scientist Intern,"Bellevue, Washington, USA",Full Time,Entry-level,Big Data,Data Analytics,Data Mining,Engineering,Machine Learning,Mathematics,Career development,Equity,,,,,"Big Data, Data Analytics, Data Mining, Engineering, Machine Learning, Mathematics","Career development, Equity","applied scientist intern big data, data analytics, data mining, engineering, machine learning, mathematics"
OpenX,Intern - Machine Learning,Krakow,Internship,Entry-level,AWS,Azure,Big Data,Computer Science,Data analysis,Dataflow,Career development,Flex hours,Startup environment,,,,"AWS, Azure, Big Data, Computer Science, Data analysis, Dataflow","Career development, Flex hours, Startup environment","intern - machine learning aws, azure, big data, computer science, data analysis, dataflow"
Coda Payments,Data Science - Intern,"Kuala Lumpur, Malaysia",Internship,Entry-level,Classification,Computer Science,Engineering,Finance,FinTech,Machine Learning,Career development,Flex hours,,,,,"Classification, Computer Science, Engineering, Finance, FinTech, Machine Learning","Career development, Flex hours","data science - intern classification, computer science, engineering, finance, fintech, machine learning"
Kpler,Data Scientist - Internship,"Brussels, London, Paris, Vienna, Dubai, Houston, New …",Internship,Entry-level,Data analysis,Data quality,Data visualization,Git,Machine Learning,ML models,,,,,,,"Data analysis, Data quality, Data visualization, Git, Machine Learning, ML models",,"data scientist - internship data analysis, data quality, data visualization, git, machine learning, ml models"
Publicis Groupe,Intern Program: Data Science Intern,"Atlanta, GA, United States",Internship,Entry-level,Cluster analysis,Data analysis,Privacy,SAS,Statistics,,Career development,Competitive pay,Equity,,,,"Cluster analysis, Data analysis, Privacy, SAS, Statistics","Career development, Competitive pay, Equity","intern program: data science intern cluster analysis, data analysis, privacy, sas, statistics"
Infinitus,📈 NLP Research Intern,"San Francisco, CA",Internship,Entry-level,Conversational AI,Deep Learning,NLP,PhD,PyTorch,Research,Career development,Conferences,Startup environment,,,,"Conversational AI, Deep Learning, NLP, PhD, PyTorch, Research","Career development, Conferences, Startup environment","📈 nlp research intern conversational ai, deep learning, nlp, phd, pytorch, research"
NBCUniversal,Act Two Program - Data Engineer,"Universal City, CALIFORNIA, United States",Full Time,Entry-level,Agile,Airflow,Big Data,Computer Science,Data Analytics,Data management,Career development,Flex hours,Flex vacation,,,,"Agile, Airflow, Big Data, Computer Science, Data Analytics, Data management","Career development, Flex hours, Flex vacation","act two program - data engineer agile, airflow, big data, computer science, data analytics, data management"
Visa,Intern Associate Data Analyst – Undergrad – Austin,"Austin, TX, United States",Internship,Entry-level,Computer Science,Data Analytics,Data visualization,Engineering,Excel,SQL,Equity,Health care,Insurance,,,,"Computer Science, Data Analytics, Data visualization, Engineering, Excel, SQL","Equity, Health care, Insurance","intern associate data analyst – undergrad – austin computer science, data analytics, data visualization, engineering, excel, sql"
Infinitus,📊 Data Analyst Intern - Business & Product Ops,"San Francisco, CA",Internship,Entry-level,BigQuery,Conversational AI,Data visualization,Engineering,Excel,GCP,Startup environment,,,,,,"BigQuery, Conversational AI, Data visualization, Engineering, Excel, GCP",Startup environment,"📊 data analyst intern - business & product ops bigquery, conversational ai, data visualization, engineering, excel, gcp"
Unbabel,AI Research Scientist Intern,"Lisbon, Lisbon, Portugal",Internship,Entry-level,Computer Science,Deep Learning,Engineering,Machine Learning,NLP,PhD,Career development,Competitive pay,Conferences,,,,"Computer Science, Deep Learning, Engineering, Machine Learning, NLP, PhD","Career development, Competitive pay, Conferences","ai research scientist intern computer science, deep learning, engineering, machine learning, nlp, phd"
Visa,Internship - Data Science (For Current Students),"Johannesburg, South Africa",Full Time,Entry-level,Big Data,Clustering,Computer Science,Data analysis,Data Mining,Econometrics,Career development,,,,,,"Big Data, Clustering, Computer Science, Data analysis, Data Mining, Econometrics",Career development,"internship - data science (for current students) big data, clustering, computer science, data analysis, data mining, econometrics"
METRO/MAKRO,STAGE 6 mois - Data Scientist Junior H/F,"Nanterre, France",Full Time,Entry-level,Big Data,Power BI,Python,R,SQL,,,,,,,,"Big Data, Power BI, Python, R, SQL",,"stage 6 mois - data scientist junior h/f big data, power bi, python, r, sql"
Bosch Group,Internship - Master Data Management,"Solothurn/Zuchwil, Switzerland",Internship,Entry-level,Data Analytics,Data management,Excel,Industrial,Spark,,Flex hours,Startup environment,,,,,"Data Analytics, Data management, Excel, Industrial, Spark","Flex hours, Startup environment","internship - master data management data analytics, data management, excel, industrial, spark"
Mercedes-Benz R&D North America,Machine Learning Intern,"Sunnyvale, CA",Internship,Entry-level,Agile,ANN,Architecture,Autonomous Driving,Computer Science,Data analysis,401(k) matching,Career development,Fitness / gym,,,,"Agile, ANN, Architecture, Autonomous Driving, Computer Science, Data analysis","401(k) matching, Career development, Fitness / gym","machine learning intern agile, ann, architecture, autonomous driving, computer science, data analysis"
Funding Societies,Data Science Intern,"Bengaluru, Karnataka, India - Remote",Internship,Entry-level,A/B testing,Computer Science,Data analysis,Data visualization,FinTech,Machine Learning,Career development,Flex hours,Flex vacation,,,,"A/B testing, Computer Science, Data analysis, Data visualization, FinTech, Machine Learning","Career development, Flex hours, Flex vacation","data science intern a/b testing, computer science, data analysis, data visualization, fintech, machine learning"
"Cloudflare, Inc.",Data Engineering Internship,"Lisbon, Portugal",Internship,Entry-level,Angular,APIs,Architecture,Computer Science,Data Analytics,Engineering,,,,,,,"Angular, APIs, Architecture, Computer Science, Data Analytics, Engineering",,"data engineering internship angular, apis, architecture, computer science, data analytics, engineering"
Bosch Group,[Intern] AI/ Computer Vision Engineer,"Tân Bình, Vietnam",Full Time,Entry-level,Computer Science,Computer Vision,Consulting,Deep Learning,Economics,Engineering,Career development,Team events,,,,,"Computer Science, Computer Vision, Consulting, Deep Learning, Economics, Engineering","Career development, Team events","[intern] ai/ computer vision engineer computer science, computer vision, consulting, deep learning, economics, engineering"
RYTE Corporation,R&D Data Scientist Intern (Alternance),"Paris, Île-de-France, France",Internship,Entry-level,Big Data,Computer Science,Deep Learning,Engineering,Keras,Python,Career development,Flex vacation,,,,,"Big Data, Computer Science, Deep Learning, Engineering, Keras, Python","Career development, Flex vacation","r&d data scientist intern (alternance) big data, computer science, deep learning, engineering, keras, python"
Amazon.com,"Software Development Engineer Intern (Summer 2023) - Machine Learning Apps, Acceleration, Annapurna Labs","Austin, Texas, USA",Full Time,Entry-level,AWS,Computer Science,Deep Learning,Distributed Systems,EC2,Engineering,Career development,Conferences,,,,,"AWS, Computer Science, Deep Learning, Distributed Systems, EC2, Engineering","Career development, Conferences","software development engineer intern (summer 2023) - machine learning apps, acceleration, annapurna labs aws, computer science, deep learning, distributed systems, ec2, engineering"
RYTE Corporation,Data Scientist (NLP & ML) Intern (Alternance),"Paris, Île-de-France, France",Internship,Entry-level,Azure,Big Data,C++,Computer Science,Deep Learning,Docker,Career development,,,,,,"Azure, Big Data, C++, Computer Science, Deep Learning, Docker",Career development,"data scientist (nlp & ml) intern (alternance) azure, big data, c++, computer science, deep learning, docker"
Sia Partners,Stage de fin d'études - Consultant(e) Data Management,"Paris, France",Full Time,Entry-level,APIs,Architecture,AWS,Azure,Big Data,Business Intelligence,,,,,,,"APIs, Architecture, AWS, Azure, Big Data, Business Intelligence",,"stage de fin d'études - consultant(e) data management apis, architecture, aws, azure, big data, business intelligence"
RYTE Corporation,MLOps Engineer Intern (Alternance),"Paris, Île-de-France, France",Internship,Entry-level,Azure,Big Data,CI/CD,Computer Science,Databricks,Deep Learning,Career development,,,,,,"Azure, Big Data, CI/CD, Computer Science, Databricks, Deep Learning",Career development,"mlops engineer intern (alternance) azure, big data, ci/cd, computer science, databricks, deep learning"
SOMFY Group,Alternance Data Analyst (H/F),"Cluses, France",Full Time,Entry-level,Data analysis,Excel,Power BI,Python,R,R&D,Salary bonus,,,,,,"Data analysis, Excel, Power BI, Python, R, R&D",Salary bonus,"alternance data analyst (h/f) data analysis, excel, power bi, python, r, r&d"
EcoVadis,Data Management Intern (12 months Internship),"Ebène, Mauritius",Internship,Entry-level,Classification,Data management,Excel,Research,,,Career development,Flex hours,Health care,,,,"Classification, Data management, Excel, Research","Career development, Flex hours, Health care","data management intern (12 months internship) classification, data management, excel, research"
OpenX,"Intern, ML Ops",New York City,Internship,Entry-level,AWS,Azure,Computer Science,Docker,GCP,Google Cloud,Career development,Startup environment,,,,,"AWS, Azure, Computer Science, Docker, GCP, Google Cloud","Career development, Startup environment","intern, ml ops aws, azure, computer science, docker, gcp, google cloud"
Bosch Group,Website & Data analyses - Internship EU student,"Breda, Netherlands",Full Time,Entry-level,E-commerce,Research,Testing,,,,Flex hours,,,,,,"E-commerce, Research, Testing",Flex hours,"website & data analyses - internship eu student e-commerce, research, testing"
HeadLight Technologies Inc.,Computer Vision Intern,"Seattle, Washington, United States - Remote",Internship,Entry-level,Computer Vision,Consulting,Engineering,Machine Learning,,,Career development,,,,,,"Computer Vision, Consulting, Engineering, Machine Learning",Career development,"computer vision intern computer vision, consulting, engineering, machine learning"
Trust Lab,"Data Science Intern | Social Media Analysis | US, Canada, UK, Germany",Anywhere,Internship,Entry-level,AWS,Data analysis,Data visualization,Engineering,Machine intelligence,Machine Learning,Flex hours,Startup environment,,,,,"AWS, Data analysis, Data visualization, Engineering, Machine intelligence, Machine Learning","Flex hours, Startup environment","data science intern | social media analysis | us, canada, uk, germany aws, data analysis, data visualization, engineering, machine intelligence, machine learning"
TuneIn,Data Science Intern,"San Francisco, CA",Internship,Entry-level,Computer Science,Data Mining,Deep Learning,Engineering,Excel,KPIs,Career development,,,,,,"Computer Science, Data Mining, Deep Learning, Engineering, Excel, KPIs",Career development,"data science intern computer science, data mining, deep learning, engineering, excel, kpis"
Deep6.ai,"Machine Learning Engineer, Comprehension Intern","Remote or Pasadena, CA",Internship,Entry-level,Computer Science,ETL,Machine Learning,Mathematics,NLP,OOP,Career development,Competitive pay,Startup environment,,,,"Computer Science, ETL, Machine Learning, Mathematics, NLP, OOP","Career development, Competitive pay, Startup environment","machine learning engineer, comprehension intern computer science, etl, machine learning, mathematics, nlp, oop"
Deep6.ai,"Data Analyst, Search Intern","Remote or Pasadena, CA",Internship,Entry-level,Business Analytics,Computer Science,Machine Learning,Mathematics,NLP,Python,Competitive pay,Startup environment,,,,,"Business Analytics, Computer Science, Machine Learning, Mathematics, NLP, Python","Competitive pay, Startup environment","data analyst, search intern business analytics, computer science, machine learning, mathematics, nlp, python"
Motional,Summer 2023: Machine Learning Intern,"Pittsburgh, Pennsylvania, United States",Internship,Entry-level,Architecture,Autonomous Driving,Computer Science,Data Mining,Distributed Systems,Machine Learning,401(k) matching,Career development,Equity,,,,"Architecture, Autonomous Driving, Computer Science, Data Mining, Distributed Systems, Machine Learning","401(k) matching, Career development, Equity","summer 2023: machine learning intern architecture, autonomous driving, computer science, data mining, distributed systems, machine learning"
Kinaxis,"Co-Op/Intern Software Engineer, AI Platform","Toronto, Canada; Remote, Canada",Internship,Entry-level,Big Data,Bitbucket,DevOps,Engineering,GitHub,Industrial,,,,,,,"Big Data, Bitbucket, DevOps, Engineering, GitHub, Industrial",,"co-op/intern software engineer, ai platform big data, bitbucket, devops, engineering, github, industrial"
Deutsche Telekom IT Solutions,Data Science Trainee - REF1574S,"Budapest, Debrecen, Szeged, Pécs, Hungary",Full Time,Entry-level,Agile,Computer Science,Jira,Kanban,Keras,Machine Learning,Team events,,,,,,"Agile, Computer Science, Jira, Kanban, Keras, Machine Learning",Team events,"data science trainee - ref1574s agile, computer science, jira, kanban, keras, machine learning"
SOMFY Group,Data Analyst (6 month internship) (M/F),"Cluses, France",Internship,Entry-level,Data management,Data quality,R,R&D,Testing,,Career development,,,,,,"Data management, Data quality, R, R&D, Testing",Career development,"data analyst (6 month internship) (m/f) data management, data quality, r, r&d, testing"
Visa,"Intern, Associate Data Analyst","Austin, TX, United States",Internship,Entry-level,Computer Science,Data Analytics,Data visualization,Engineering,Excel,SQL,Equity,Health care,Insurance,,,,"Computer Science, Data Analytics, Data visualization, Engineering, Excel, SQL","Equity, Health care, Insurance","intern, associate data analyst computer science, data analytics, data visualization, engineering, excel, sql"
Charles River Analytics Inc.,Natural Language Processing Intern,"Cambridge, MA",Internship,Entry-level,Computer Science,LLMs,Machine Learning,NLP,OOP,Prototyping,Career development,Flex vacation,Snacks / Drinks,,,,"Computer Science, LLMs, Machine Learning, NLP, OOP, Prototyping","Career development, Flex vacation, Snacks / Drinks","natural language processing intern computer science, llms, machine learning, nlp, oop, prototyping"
Spendesk,Data Scientist Intern,Paris,Internship,Entry-level,Classification,Computer Science,Data visualization,Deep Learning,Finance,Linear algebra,Career development,Gear,Health care,,,,"Classification, Computer Science, Data visualization, Deep Learning, Finance, Linear algebra","Career development, Gear, Health care","data scientist intern classification, computer science, data visualization, deep learning, finance, linear algebra"
Amazon.com,Amazon Robotics - Applied Scientist Intern - 2023,"Westborough, Massachusetts, USA",Full Time,Entry-level,Computer Science,Computer Vision,Engineering,Machine Learning,Mathematics,PhD,,,,,,,"Computer Science, Computer Vision, Engineering, Machine Learning, Mathematics, PhD",,"amazon robotics - applied scientist intern - 2023 computer science, computer vision, engineering, machine learning, mathematics, phd"
"DataCamp, Inc.",Machine Learning Content Development Intern,United Kingdom or Belgium,Internship,Entry-level,Engineering,GitHub,Machine Learning,MLFlow,Python,Teaching,Career development,Competitive pay,Equity,,,,"Engineering, GitHub, Machine Learning, MLFlow, Python, Teaching","Career development, Competitive pay, Equity","machine learning content development intern engineering, github, machine learning, mlflow, python, teaching"
Visium,Junior Machine Learning Engineer - Zürich (internship),"Zürich, Zurich, Switzerland",Internship,Entry-level,Classification,Clustering,Computer Science,D3,Deep Learning,Engineering,Career development,Startup environment,Team events,,,,"Classification, Clustering, Computer Science, D3, Deep Learning, Engineering","Career development, Startup environment, Team events","junior machine learning engineer - zürich (internship) classification, clustering, computer science, d3, deep learning, engineering"
OpenX,Data Scientist - Intern,"Los Angeles, CA",Internship,Entry-level,Architecture,AWS,Big Data,Computer Science,Data analysis,GCP,Career development,Startup environment,,,,,"Architecture, AWS, Big Data, Computer Science, Data analysis, GCP","Career development, Startup environment","data scientist - intern architecture, aws, big data, computer science, data analysis, gcp"
Blueground,Data Analysis Intern - Istanbul,"İstanbul, İstanbul, Turkey",Internship,Entry-level,Business Intelligence,Data analysis,Data Analytics,Data quality,Engineering,Excel,Career development,Competitive pay,Flex hours,,,,"Business Intelligence, Data analysis, Data Analytics, Data quality, Engineering, Excel","Career development, Competitive pay, Flex hours","data analysis intern - istanbul business intelligence, data analysis, data analytics, data quality, engineering, excel"
Visium,Junior Machine Learning Engineer - Lausanne (internship),"Lausanne, Vaud, Switzerland",Internship,Entry-level,Classification,Clustering,Computer Science,D3,Deep Learning,Engineering,Career development,Startup environment,Team events,,,,"Classification, Clustering, Computer Science, D3, Deep Learning, Engineering","Career development, Startup environment, Team events","junior machine learning engineer - lausanne (internship) classification, clustering, computer science, d3, deep learning, engineering"
Steel Perlot,Sports Data Science Intern,"Los Angeles, California, San Francisco, California, New …",Internship,Entry-level,Bayesian,CI/CD,Computer Science,Data analysis,Data management,Engineering,401(k) matching,Career development,Competitive pay,,,,"Bayesian, CI/CD, Computer Science, Data analysis, Data management, Engineering","401(k) matching, Career development, Competitive pay","sports data science intern bayesian, ci/cd, computer science, data analysis, data management, engineering"
Scandit,Computer Vision / Machine Learning Intern,Zürich,Internship,Entry-level,C++,Computer Science,Computer Vision,Machine Learning,ML models,NLP,Career development,Startup environment,Team events,,,,"C++, Computer Science, Computer Vision, Machine Learning, ML models, NLP","Career development, Startup environment, Team events","computer vision / machine learning intern c++, computer science, computer vision, machine learning, ml models, nlp"
CGG,Machine Learning Engineer 2023 Internship Programme (6 months),"Crawley, United Kingdom",Internship,Entry-level,C++,Computer Science,Deep Learning,HPC,Machine Learning,Mathematics,Career development,Competitive pay,Fitness / gym,,,,"C++, Computer Science, Deep Learning, HPC, Machine Learning, Mathematics","Career development, Competitive pay, Fitness / gym","machine learning engineer 2023 internship programme (6 months) c++, computer science, deep learning, hpc, machine learning, mathematics"
Publicis Groupe,Junior Data Analyst - Extra Curricular Internship,"Torino, Italy",Full Time,Entry-level,Big Data,Computer Science,Consulting,Data analysis,Data Mining,Data quality,Flex hours,Wellness,,,,,"Big Data, Computer Science, Consulting, Data analysis, Data Mining, Data quality","Flex hours, Wellness","junior data analyst - extra curricular internship big data, computer science, consulting, data analysis, data mining, data quality"
Bosch Group,Intern for AI Machine Learning - AquaEasy,"Singapore, Singapore",Full Time,Entry-level,Data analysis,Data visualization,Machine Learning,Python,R,R&D,Career development,,,,,,"Data analysis, Data visualization, Machine Learning, Python, R, R&D",Career development,"intern for ai machine learning - aquaeasy data analysis, data visualization, machine learning, python, r, r&d"
