Company,Job Title,Location,Job Type,Experience,Skill 1,Skill 2,Skill 3,Skill 4,Skill 5,Skill 6,Perk 1,Perk 2,Perk 3,Perk 4,Perk 5,Perk 6,Required Skills,all_perks,tags
Censys,2023 Software Engineering Internship - Data Engineer,"Ann Arbor, Michigan, United States",Internship,Entry-level,ANN,Engineering,Golang,Helm,Python,Research,Competitive pay,Home office stipend,Startup environment,,,,"ANN, Engineering, Golang, Helm, Python, Research","Competitive pay, Home office stipend, Startup environment","2023 software engineering internship - data engineer ann, engineering, golang, helm, python, research"
Bosch Group,[Intern] AI/ Computer Vision Engineer,"Tân Bình, Vietnam",Full Time,Entry-level,Computer Science,Computer Vision,Consulting,Deep Learning,Economics,Engineering,Career development,Team events,,,,,"Computer Science, Computer Vision, Consulting, Deep Learning, Economics, Engineering","Career development, Team events","[intern] ai/ computer vision engineer computer science, computer vision, consulting, deep learning, economics, engineering"
Publicis Groupe,"Intern, Data Science & Analytics","Miami, FL, United States",Internship,Entry-level,Data strategy,Data Studio,Excel,Power BI,Python,Research,Flex hours,Flex vacation,Insurance,,,,"Data strategy, Data Studio, Excel, Power BI, Python, Research","Flex hours, Flex vacation, Insurance","intern, data science & analytics data strategy, data studio, excel, power bi, python, research"
Bosch Group,Internship for BigData Analysis in the areas of Project Management and SW Development Metrics,"Abstatt, Germany",Internship,Entry-level,Azure,Big Data,Computer Science,Data analysis,Engineering,Excel,Career development,Team events,,,,,"Azure, Big Data, Computer Science, Data analysis, Engineering, Excel","Career development, Team events","internship for bigdata analysis in the areas of project management and sw development metrics azure, big data, computer science, data analysis, engineering, excel"
Informa Group Plc.,Data Analytics Intern (Summer 2023),"Washington, DC, United States",Internship,Entry-level,Big Data,BigQuery,Computer Science,Data analysis,Data Analytics,Data Studio,Competitive pay,Startup environment,,,,,"Big Data, BigQuery, Computer Science, Data analysis, Data Analytics, Data Studio","Competitive pay, Startup environment","data analytics intern (summer 2023) big data, bigquery, computer science, data analysis, data analytics, data studio"
Facilities Management Express,Customer Data Specialist Intern,"Columbus, Ohio, United States - Remote",Internship,Entry-level,Airtable,APIs,Business Analytics,Business Intelligence,Data visualization,ETL,Career development,Competitive pay,Flex vacation,,,,"Airtable, APIs, Business Analytics, Business Intelligence, Data visualization, ETL","Career development, Competitive pay, Flex vacation","customer data specialist intern airtable, apis, business analytics, business intelligence, data visualization, etl"
AppLovin,Project Manager Intern - SparkLabs,San Francisco Bay Area,Internship,Entry-level,Excel,Jira,Privacy,Testing,,,Career development,,,,,,"Excel, Jira, Privacy, Testing",Career development,"project manager intern - sparklabs excel, jira, privacy, testing"
"Chemix, Inc.",Machine Learning Research Engineer Internship,"Sunnyvale, California, United States",Internship,Entry-level,Chemistry,CI/CD,Git,Machine Learning,ML models,NumPy,401(k) matching,Career development,Equity,,,,"Chemistry, CI/CD, Git, Machine Learning, ML models, NumPy","401(k) matching, Career development, Equity","machine learning research engineer internship chemistry, ci/cd, git, machine learning, ml models, numpy"
Lyft,"Canada - Early Talent - Data Science Intern, Decisions-Product - Montreal, Canada (Summer 2023)","Montreal, Canada",Internship,Entry-level,A/B testing,Biology,Computer Science,Economics,Engineering,Mathematics,Health care,Startup environment,,,,,"A/B testing, Biology, Computer Science, Economics, Engineering, Mathematics","Health care, Startup environment","canada - early talent - data science intern, decisions-product - montreal, canada (summer 2023) a/b testing, biology, computer science, economics, engineering, mathematics"
EcoVadis,Data Management Intern (12 months Internship),"Ebène, Mauritius",Internship,Entry-level,Classification,Data management,Excel,Research,,,Career development,Flex hours,Health care,,,,"Classification, Data management, Excel, Research","Career development, Flex hours, Health care","data management intern (12 months internship) classification, data management, excel, research"
"Chemix, Inc.",Battery Data Science Intern,"Sunnyvale, California, United States",Internship,Entry-level,Chemistry,CI/CD,Computer Science,Data pipelines,Engineering,Git,401(k) matching,Career development,Equity,,,,"Chemistry, CI/CD, Computer Science, Data pipelines, Engineering, Git","401(k) matching, Career development, Equity","battery data science intern chemistry, ci/cd, computer science, data pipelines, engineering, git"
Roofstock,Data Engineering Intern,"Oakland, CA",Internship,Entry-level,Computer Science,Engineering,Python,RDBMS,Scala,SQL,Competitive pay,Startup environment,,,,,"Computer Science, Engineering, Python, RDBMS, Scala, SQL","Competitive pay, Startup environment","data engineering intern computer science, engineering, python, rdbms, scala, sql"
SOMFY Group,Data Analyst (6 month internship) (M/F),"Cluses, France",Internship,Entry-level,Data management,Data quality,Industrial,R,R&D,Testing,Career development,,,,,,"Data management, Data quality, Industrial, R, R&D, Testing",Career development,"data analyst (6 month internship) (m/f) data management, data quality, industrial, r, r&d, testing"
Verily,"Data Science Intern, Registries and Real World Data","South San Francisco, CA",Internship,Entry-level,Biology,Computer Science,Data quality,Engineering,Machine Learning,Mathematics,Career development,Competitive pay,Equity,,,,"Biology, Computer Science, Data quality, Engineering, Machine Learning, Mathematics","Career development, Competitive pay, Equity","data science intern, registries and real world data biology, computer science, data quality, engineering, machine learning, mathematics"
Bandwidth,Network Data Science Intern,"Austin, TX",Internship,Entry-level,APIs,Privacy,,,,,Flex vacation,Health care,Unlimited paid time off,,,,"APIs, Privacy","Flex vacation, Health care, Unlimited paid time off","network data science intern apis, privacy"
Deutsche Telekom IT Solutions,Data Science Trainee - REF1574S,"Budapest, Debrecen, Szeged, Pécs, Hungary",Full Time,Entry-level,Agile,Computer Science,Jira,Kanban,Keras,Machine Learning,Team events,,,,,,"Agile, Computer Science, Jira, Kanban, Keras, Machine Learning",Team events,"data science trainee - ref1574s agile, computer science, jira, kanban, keras, machine learning"
ALTEN,Stage - Ingénieur véhicule autonome,"Sèvres, France",Full Time,Entry-level,Python,R,R&D,,,,Career development,,,,,,"Python, R, R&D",Career development,"stage - ingénieur véhicule autonome python, r, r&d"
Verily,"Data Science Intern, Computational Biology","South San Francisco, CA",Internship,Entry-level,Architecture,Biology,Computer Science,Data analysis,EDA,Engineering,Career development,Competitive pay,Health care,,,,"Architecture, Biology, Computer Science, Data analysis, EDA, Engineering","Career development, Competitive pay, Health care","data science intern, computational biology architecture, biology, computer science, data analysis, eda, engineering"
ServiceNow,"Data Analytics Intern, Innovation Operations","Santa Clara, CALIFORNIA, United States",Internship,Entry-level,Computer Science,Data Analytics,Data visualization,Economics,Excel,Finance,401(k) matching,Competitive pay,Equity,,,,"Computer Science, Data Analytics, Data visualization, Economics, Excel, Finance","401(k) matching, Competitive pay, Equity","data analytics intern, innovation operations computer science, data analytics, data visualization, economics, excel, finance"
Bosch Group,2023 Co-op Student - Digital Automation -- Data Analyst (May- Nov),"Oakbrook Terrace, IL, United States",Full Time,Entry-level,Computer Science,Engineering,Excel,Industrial,KNIME,Mathematics,Team events,,,,,,"Computer Science, Engineering, Excel, Industrial, KNIME, Mathematics",Team events,"2023 co-op student - digital automation -- data analyst (may- nov) computer science, engineering, excel, industrial, knime, mathematics"
G2,Summer Intern: Data Science,Chicago,Internship,Entry-level,AWS,Data analysis,EDA,Machine Learning,ML infrastructure,NLP,Career development,Flex vacation,Parental leave,,,,"AWS, Data analysis, EDA, Machine Learning, ML infrastructure, NLP","Career development, Flex vacation, Parental leave","summer intern: data science aws, data analysis, eda, machine learning, ml infrastructure, nlp"
METRO/MAKRO,STAGE 6 mois - Data Scientist Junior H/F,"Nanterre, France",Full Time,Entry-level,Big Data,Power BI,Python,R,SQL,,,,,,,,"Big Data, Power BI, Python, R, SQL",,"stage 6 mois - data scientist junior h/f big data, power bi, python, r, sql"
"Cloudflare, Inc.",Data Engineer - Intern (Summer 2023),San Francisco or Austin,Internship,Entry-level,Angular,APIs,Architecture,Computer Science,Data Analytics,Engineering,,,,,,,"Angular, APIs, Architecture, Computer Science, Data Analytics, Engineering",,"data engineer - intern (summer 2023) angular, apis, architecture, computer science, data analytics, engineering"
Back Market,Business Data Analyst Intern (APAC),Paris,Internship,Entry-level,Consulting,Data visualization,KPIs,Python,SQL,Tableau,Flex hours,Health care,Insurance,,,,"Consulting, Data visualization, KPIs, Python, SQL, Tableau","Flex hours, Health care, Insurance","business data analyst intern (apac) consulting, data visualization, kpis, python, sql, tableau"
Voodoo,Junior Data Analyst (end-of-studies internship),Paris,Internship,Entry-level,Consulting,Engineering,Excel,Machine Learning,Mathematics,SQL,Career development,Competitive pay,Lunch / meals,,,,"Consulting, Engineering, Excel, Machine Learning, Mathematics, SQL","Career development, Competitive pay, Lunch / meals","junior data analyst (end-of-studies internship) consulting, engineering, excel, machine learning, mathematics, sql"
Wavestone,Consultant.e.s – Stage/Alternance -  IT & Data Architecture,"Nantes, France",Full Time,Entry-level,APIs,Architecture,AWS,Azure,Big Data,DevOps,,,,,,,"APIs, Architecture, AWS, Azure, Big Data, DevOps",,"consultant.e.s – stage/alternance -  it & data architecture apis, architecture, aws, azure, big data, devops"
Deezer,Product Data Analyst Intern m/f/d,"Paris, France",Internship,Entry-level,Data analysis,Data pipelines,Data visualization,KPIs,Pipelines,Python,Career development,Health care,Insurance,,,,"Data analysis, Data pipelines, Data visualization, KPIs, Pipelines, Python","Career development, Health care, Insurance","product data analyst intern m/f/d data analysis, data pipelines, data visualization, kpis, pipelines, python"
Amazon.com,2023 Business Intelligence Engineer Internship,"Milan, Lombardy, ITA",Full Time,Entry-level,AWS,Business Intelligence,Computer Science,Data Mining,Data pipelines,Data warehouse,Career development,Competitive pay,Flex hours,,,,"AWS, Business Intelligence, Computer Science, Data Mining, Data pipelines, Data warehouse","Career development, Competitive pay, Flex hours","2023 business intelligence engineer internship aws, business intelligence, computer science, data mining, data pipelines, data warehouse"
Syngenta Group,Data Scientist Trainee (m/w/d),"Frankfurt am Main, Germany",Full Time,Entry-level,AWS,Big Data,Data Mining,Deep Learning,Machine Learning,NoSQL,,,,,,,"AWS, Big Data, Data Mining, Deep Learning, Machine Learning, NoSQL",,"data scientist trainee (m/w/d) aws, big data, data mining, deep learning, machine learning, nosql"
Publicis Groupe,"Data Science & Analytics, Summer Intern","Springdale, AR, United States",Internship,Entry-level,Data visualization,Excel,Mathematics,Statistics,STEM,Tableau,Career development,Home office stipend,Insurance,,,,"Data visualization, Excel, Mathematics, Statistics, STEM, Tableau","Career development, Home office stipend, Insurance","data science & analytics, summer intern data visualization, excel, mathematics, statistics, stem, tableau"
Wavestone,Business Intelligence & Data Visualization,"Paris, France",Full Time,Entry-level,Agile,Business Intelligence,Data visualization,Machine Learning,Research,UX,,,,,,,"Agile, Business Intelligence, Data visualization, Machine Learning, Research, UX",,"business intelligence & data visualization agile, business intelligence, data visualization, machine learning, research, ux"
Moloco,Data Analyst Intern - Singapore,"Singapore, Central Singapore, Singapore",Internship,Entry-level,Data analysis,GCP,Google Cloud,Machine Learning,ML models,Python,Career development,,,,,,"Data analysis, GCP, Google Cloud, Machine Learning, ML models, Python",Career development,"data analyst intern - singapore data analysis, gcp, google cloud, machine learning, ml models, python"
Funding Societies,Data Analyst Intern,"Bangkok, Bangkok, Thailand - Remote",Internship,Entry-level,Business Intelligence,Data Analytics,Data visualization,Data warehouse,Finance,FinTech,Career development,Flex hours,Flex vacation,,,,"Business Intelligence, Data Analytics, Data visualization, Data warehouse, Finance, FinTech","Career development, Flex hours, Flex vacation","data analyst intern business intelligence, data analytics, data visualization, data warehouse, finance, fintech"
Guardant Health,Machine Learning/Artificial Intelligence Intern,"Palo Alto, CA, United States",Internship,Entry-level,Biology,Computer Science,HPC,Linux,Machine Learning,NLP,Career development,Equity,Health care,,,,"Biology, Computer Science, HPC, Linux, Machine Learning, NLP","Career development, Equity, Health care","machine learning/artificial intelligence intern biology, computer science, hpc, linux, machine learning, nlp"
Merlin Labs,"NLP Software Engineer, Intern",Boston,Internship,Entry-level,BERT,Computer Science,Data analysis,GitHub,GPT,Machine Learning,401(k) matching,Career development,Health care,,,,"BERT, Computer Science, Data analysis, GitHub, GPT, Machine Learning","401(k) matching, Career development, Health care","nlp software engineer, intern bert, computer science, data analysis, github, gpt, machine learning"
Snowflake Inc.,Data Engineer - Intern,"Pune, India",Internship,Entry-level,Airflow,APIs,AWS,Azure,Computer Science,Data pipelines,,,,,,,"Airflow, APIs, AWS, Azure, Computer Science, Data pipelines",,"data engineer - intern airflow, apis, aws, azure, computer science, data pipelines"
Outrider,"Perception Intern, Deep Learning Data","Brighton, Colorado",Internship,Entry-level,AWS,Deep Learning,Docker,Git,Lidar,Python,,,,,,,"AWS, Deep Learning, Docker, Git, Lidar, Python",,"perception intern, deep learning data aws, deep learning, docker, git, lidar, python"
Moloco,Data Analyst Intern - Korea,"Gangnam-gu, Seoul, South Korea",Internship,Entry-level,Data analysis,GCP,Google Cloud,Machine Learning,ML models,Python,Career development,,,,,,"Data analysis, GCP, Google Cloud, Machine Learning, ML models, Python",Career development,"data analyst intern - korea data analysis, gcp, google cloud, machine learning, ml models, python"
Bosch Group,[Intern] AI/ Computer Vision Engineer,"Tân Bình, Vietnam",Full Time,Entry-level,Computer Science,Computer Vision,Consulting,Deep Learning,Economics,Engineering,Career development,Team events,,,,,"Computer Science, Computer Vision, Consulting, Deep Learning, Economics, Engineering","Career development, Team events","[intern] ai/ computer vision engineer computer science, computer vision, consulting, deep learning, economics, engineering"
Bosch Group,"Intern, AI research engineer","Singapore, Singapore",Internship,Entry-level,Computer Science,Computer Vision,Deep Learning,Engineering,Industrial,Machine Learning,Career development,,,,,,"Computer Science, Computer Vision, Deep Learning, Engineering, Industrial, Machine Learning",Career development,"intern, ai research engineer computer science, computer vision, deep learning, engineering, industrial, machine learning"
Western Digital,"Phd -Interns, Data Scientist","Bengaluru, India",Full Time,Entry-level,Agile,Architecture,Classification,Data Mining,Data pipelines,Deep Learning,,,,,,,"Agile, Architecture, Classification, Data Mining, Data pipelines, Deep Learning",,"phd -interns, data scientist agile, architecture, classification, data mining, data pipelines, deep learning"
Schrödinger,Computational Biology Intern,New York,Internship,Entry-level,Biology,Computer Science,Deep Learning,Drug discovery,Machine Learning,Python,401(k) matching,Career development,Competitive pay,,,,"Biology, Computer Science, Deep Learning, Drug discovery, Machine Learning, Python","401(k) matching, Career development, Competitive pay","computational biology intern biology, computer science, deep learning, drug discovery, machine learning, python"
Amazon.com,Amazon Robotics - Applied Scientist Intern/Co-op - 2023,"Westborough, Massachusetts, USA",Full Time,Entry-level,Computer Science,Computer Vision,Engineering,Machine Learning,Mathematics,PhD,,,,,,,"Computer Science, Computer Vision, Engineering, Machine Learning, Mathematics, PhD",,"amazon robotics - applied scientist intern/co-op - 2023 computer science, computer vision, engineering, machine learning, mathematics, phd"
Block,PhD Machine Learning Engineer Intern (Summer 2023),"San Francisco, CA, United States",Internship,Entry-level,Architecture,AWS,Banking,Blockchain,Computer Science,Crypto,Career development,Equity,Health care,,,,"Architecture, AWS, Banking, Blockchain, Computer Science, Crypto","Career development, Equity, Health care","phd machine learning engineer intern (summer 2023) architecture, aws, banking, blockchain, computer science, crypto"
Chime,Reporting and Data Infrastructure Intern,"Remote, San Francisco",Internship,Entry-level,Banking,Computer Science,Data governance,FinTech,LookML,Privacy,401(k) matching,Career development,Competitive pay,,,,"Banking, Computer Science, Data governance, FinTech, LookML, Privacy","401(k) matching, Career development, Competitive pay","reporting and data infrastructure intern banking, computer science, data governance, fintech, lookml, privacy"
Jump Trading,Campus | Data Engineer (Intern),Singapore,Internship,Entry-level,Data Analytics,Economics,Engineering,Finance,Linux,MySQL,Career development,,,,,,"Data Analytics, Economics, Engineering, Finance, Linux, MySQL",Career development,"campus | data engineer (intern) data analytics, economics, engineering, finance, linux, mysql"
"Cloudflare, Inc.",Data Analyst Intern (Summer 2023),Remote US,Internship,Entry-level,Big Data,BigQuery,Computer Science,Data Analytics,Engineering,Finance,Career development,Startup environment,,,,,"Big Data, BigQuery, Computer Science, Data Analytics, Engineering, Finance","Career development, Startup environment","data analyst intern (summer 2023) big data, bigquery, computer science, data analytics, engineering, finance"
Block,Data Science Intern (Summer 2023),"San Francisco, CA, United States",Internship,Entry-level,A/B testing,Airflow,Banking,BigQuery,Blockchain,Computer Science,Career development,Equity,Flex vacation,,,,"A/B testing, Airflow, Banking, BigQuery, Blockchain, Computer Science","Career development, Equity, Flex vacation","data science intern (summer 2023) a/b testing, airflow, banking, bigquery, blockchain, computer science"
GoodRx,Data Engineer Internship,"Santa Monica, CA",Internship,Entry-level,AWS,Data pipelines,DevOps,Engineering,ETL,Excel,Health care,,,,,,"AWS, Data pipelines, DevOps, Engineering, ETL, Excel",Health care,"data engineer internship aws, data pipelines, devops, engineering, etl, excel"
Chime,Data Analytics Intern: Consumer Economics,"San Francisco, CA",Internship,Entry-level,Banking,Data Analytics,Data visualization,Economics,FinTech,Privacy,401(k) matching,Career development,Competitive pay,,,,"Banking, Data Analytics, Data visualization, Economics, FinTech, Privacy","401(k) matching, Career development, Competitive pay","data analytics intern: consumer economics banking, data analytics, data visualization, economics, fintech, privacy"
Guardant Health,Grad Intern: Bioinformatics/Assay Data Visualization and Analysis,"Palo Alto, CA, United States",Full Time,Entry-level,Data Analytics,Data visualization,Engineering,Matplotlib,PhD,Plotly,Career development,Health care,Salary bonus,,,,"Data Analytics, Data visualization, Engineering, Matplotlib, PhD, Plotly","Career development, Health care, Salary bonus","grad intern: bioinformatics/assay data visualization and analysis data analytics, data visualization, engineering, matplotlib, phd, plotly"
605,Data Operations Intern (Quality Assurance),"Syosset, New York, United States",Internship,Entry-level,Agile,Databricks,DataOps,Excel,Jira,PySpark,Startup environment,,,,,,"Agile, Databricks, DataOps, Excel, Jira, PySpark",Startup environment,"data operations intern (quality assurance) agile, databricks, dataops, excel, jira, pyspark"
Etsy,Data Science Intern,"Brooklyn, NY, United States",Full Time,Entry-level,Causal inference,Computer Science,Economics,Machine Learning,PhD,Python,Equity,,,,,,"Causal inference, Computer Science, Economics, Machine Learning, PhD, Python",Equity,"data science intern causal inference, computer science, economics, machine learning, phd, python"
CleverConnect,Data Engineer / Data Analyst - Stage de fin d'études - Paris 2e,"Paris, France",Full Time,Entry-level,Agile,Architecture,AWS,BigQuery,Dataflow,Data visualization,Career development,Yoga,,,,,"Agile, Architecture, AWS, BigQuery, Dataflow, Data visualization","Career development, Yoga","data engineer / data analyst - stage de fin d'études - paris 2e agile, architecture, aws, bigquery, dataflow, data visualization"
ManoMano,[Internship] - Junior Data Scientist #2 (W/M),Paris 75017,Internship,Entry-level,Agile,Biology,Computer Science,Data analysis,E-commerce,Economics,Career development,Conferences,Flex vacation,,,,"Agile, Biology, Computer Science, Data analysis, E-commerce, Economics","Career development, Conferences, Flex vacation","[internship] - junior data scientist #2 (w/m) agile, biology, computer science, data analysis, e-commerce, economics"
ManoMano,[Internship] - Junior Data Scientist #1 (W/M),Paris 75017,Internship,Entry-level,Agile,Biology,Computer Science,Data analysis,E-commerce,Economics,Career development,Conferences,Flex vacation,,,,"Agile, Biology, Computer Science, Data analysis, E-commerce, Economics","Career development, Conferences, Flex vacation","[internship] - junior data scientist #1 (w/m) agile, biology, computer science, data analysis, e-commerce, economics"
Western Digital,PhD Intern - Data Science,"Bengaluru, India",Internship,Entry-level,Big Data,Computer Science,Data Analytics,Deep Learning,Engineering,Linear algebra,Career development,Medical leave,,,,,"Big Data, Computer Science, Data Analytics, Deep Learning, Engineering, Linear algebra","Career development, Medical leave","phd intern - data science big data, computer science, data analytics, deep learning, engineering, linear algebra"
Bosch Group,Jr Data Engineer - Internship,"Cernusco sul Naviglio, Italy",Full Time,Entry-level,Business Intelligence,Computer Science,Data analysis,Engineering,Industrial,Mathematics,Startup environment,,,,,,"Business Intelligence, Computer Science, Data analysis, Engineering, Industrial, Mathematics",Startup environment,"jr data engineer - internship business intelligence, computer science, data analysis, engineering, industrial, mathematics"
605,Engineering Intern (Data Engineering),"Syosset, New York, United States",Internship,Entry-level,Agile,Architecture,AWS,Azure,Big Data,Data visualization,Career development,Startup environment,,,,,"Agile, Architecture, AWS, Azure, Big Data, Data visualization","Career development, Startup environment","engineering intern (data engineering) agile, architecture, aws, azure, big data, data visualization"
Enterpret,[Internship] Machine Learning,Remote (India),Internship,Entry-level,Deep Learning,Linear algebra,Machine Learning,NLP,NumPy,Pandas,Career development,,,,,,"Deep Learning, Linear algebra, Machine Learning, NLP, NumPy, Pandas",Career development,"[internship] machine learning deep learning, linear algebra, machine learning, nlp, numpy, pandas"
Lightcast,Research Analyst Intern (Summer 2023 ),Remote (Work From Home) US,Internship,Entry-level,Consulting,Economics,Excel,Python,Research,SQL,Career development,Team events,,,,,"Consulting, Economics, Excel, Python, Research, SQL","Career development, Team events","research analyst intern (summer 2023 ) consulting, economics, excel, python, research, sql"
605,Data Operations Intern (Data Management),"Syosset, New York, United States",Internship,Entry-level,Agile,Databricks,Data management,DataOps,Data quality,Excel,Startup environment,,,,,,"Agile, Databricks, Data management, DataOps, Data quality, Excel",Startup environment,"data operations intern (data management) agile, databricks, data management, dataops, data quality, excel"
"Chemix, Inc.",Machine Learning Research Engineer Internship,"Sunnyvale, California, United States",Internship,Entry-level,Chemistry,CI/CD,Git,Machine Learning,ML models,NumPy,401(k) matching,Career development,Equity,,,,"Chemistry, CI/CD, Git, Machine Learning, ML models, NumPy","401(k) matching, Career development, Equity","machine learning research engineer internship chemistry, ci/cd, git, machine learning, ml models, numpy"
Fifty-Five,Data Scientist Intern,"Paris, Île-de-France, France",Internship,Entry-level,Deep Learning,NumPy,Pandas,Python,R,R&D,Career development,,,,,,"Deep Learning, NumPy, Pandas, Python, R, R&D",Career development,"data scientist intern deep learning, numpy, pandas, python, r, r&d"
