Company,Job Title,Location,Job Type,Experience,Skill 1,Skill 2,Skill 3,Skill 4,Skill 5,Skill 6,Perk 1,Perk 2,Perk 3,Perk 4,Perk 5,Perk 6,Required Skills,all_perks,tags
Western Digital,"Intern, Data Engineering - Digital Innovation (Summer 2023)","Milpitas, CA, United States",Full Time,Entry-level,Computer Science,Data analysis,Data pipelines,Data quality,EDA,Engineering,Medical leave,,,,,,"Computer Science, Data analysis, Data pipelines, Data quality, EDA, Engineering",Medical leave,"intern, data engineering - digital innovation (summer 2023) computer science, data analysis, data pipelines, data quality, eda, engineering"
Zeta Global,Data Science & Analytics Intern,"New York City, NY",Internship,Entry-level,Business Intelligence,Data pipelines,ETL,Machine Learning,MySQL,Pipelines,Lunch / meals,Team events,,,,,"Business Intelligence, Data pipelines, ETL, Machine Learning, MySQL, Pipelines","Lunch / meals, Team events","data science & analytics intern business intelligence, data pipelines, etl, machine learning, mysql, pipelines"
Bosch Group,AI/ML Graduate Intern with Focus on AI Engineering (6 - 12 Months),"Mount Prospect, IL, United States",Internship,Entry-level,AWS,Azure,Computer Science,Engineering,GCP,Industrial,,,,,,,"AWS, Azure, Computer Science, Engineering, GCP, Industrial",,"ai/ml graduate intern with focus on ai engineering (6 - 12 months) aws, azure, computer science, engineering, gcp, industrial"
takealot.com,Data Analytics Intern,Cape Town,Internship,Entry-level,Data Analytics,E-commerce,,,,,Career development,Competitive pay,Flex vacation,,,,"Data Analytics, E-commerce","Career development, Competitive pay, Flex vacation","data analytics intern data analytics, e-commerce"
"Recorded Future, Inc.",Data Science Intern,"Boston, MA",Internship,Entry-level,Python,Security,,,,,Startup environment,,,,,,"Python, Security",Startup environment,"data science intern python, security"
Verisk,Data Analytics Intern (Pricing Analyst) - 2023  Summer Internship Program - CR,"Kraków, Poland",Part Time,Entry-level,Business Intelligence,Data analysis,Data Analytics,Data management,Data quality,Data visualization,Career development,Equity,Insurance,,,,"Business Intelligence, Data analysis, Data Analytics, Data management, Data quality, Data visualization","Career development, Equity, Insurance","data analytics intern (pricing analyst) - 2023  summer internship program - cr business intelligence, data analysis, data analytics, data management, data quality, data visualization"
Unite Us,Internship: Data Analyst Intern,New York City,Internship,Entry-level,Computer Science,Data Analytics,Mathematics,Physics,SQL,Statistics,Startup environment,,,,,,"Computer Science, Data Analytics, Mathematics, Physics, SQL, Statistics",Startup environment,"internship: data analyst intern computer science, data analytics, mathematics, physics, sql, statistics"
CleverConnect,Data Analyst - Stage de fin d'études - Paris 2e,"Paris, France",Full Time,Entry-level,Agile,Architecture,AWS,BigQuery,Dataflow,Data visualization,Career development,Yoga,,,,,"Agile, Architecture, AWS, BigQuery, Dataflow, Data visualization","Career development, Yoga","data analyst - stage de fin d'études - paris 2e agile, architecture, aws, bigquery, dataflow, data visualization"
Bosch Group,Internship Big Data for Fleet Validation,"Stuttgart, Germany",Full Time,Entry-level,Agile,Azure,Big Data,Data analysis,Databricks,Engineering,Startup environment,,,,,,"Agile, Azure, Big Data, Data analysis, Databricks, Engineering",Startup environment,"internship big data for fleet validation agile, azure, big data, data analysis, databricks, engineering"
CleverConnect,Data Engineer - Stage de fin d'études - Paris 2e,"Paris, France",Full Time,Entry-level,Agile,Architecture,AWS,BigQuery,Dataflow,Data visualization,Career development,Yoga,,,,,"Agile, Architecture, AWS, BigQuery, Dataflow, Data visualization","Career development, Yoga","data engineer - stage de fin d'études - paris 2e agile, architecture, aws, bigquery, dataflow, data visualization"
Balbix,AI/ML Summer Intern,"San Jose, CA",Internship,Entry-level,Data pipelines,Distributed Systems,Engineering,Linear algebra,Machine Learning,ML infrastructure,Career development,Flex vacation,Health care,,,,"Data pipelines, Distributed Systems, Engineering, Linear algebra, Machine Learning, ML infrastructure","Career development, Flex vacation, Health care","ai/ml summer intern data pipelines, distributed systems, engineering, linear algebra, machine learning, ml infrastructure"
Unite Us,Internship: Data Science Intern,New York City,Internship,Entry-level,Computer Science,Mathematics,Pandas,Physics,Python,Research,Career development,,,,,,"Computer Science, Mathematics, Pandas, Physics, Python, Research",Career development,"internship: data science intern computer science, mathematics, pandas, physics, python, research"
Syngenta Group,Data Scientist Trainee (m/w/d),"Frankfurt am Main, Germany",Full Time,Entry-level,AWS,Big Data,Data Mining,Deep Learning,Machine Learning,NoSQL,,,,,,,"AWS, Big Data, Data Mining, Deep Learning, Machine Learning, NoSQL",,"data scientist trainee (m/w/d) aws, big data, data mining, deep learning, machine learning, nosql"
Dyno Therapeutics,Machine Learning Engineer Summer 2023 Internship,"Watertown, MA",Internship,Entry-level,Biology,Computer Science,Engineering,Machine Learning,Mathematics,ML infrastructure,Startup environment,,,,,,"Biology, Computer Science, Engineering, Machine Learning, Mathematics, ML infrastructure",Startup environment,"machine learning engineer summer 2023 internship biology, computer science, engineering, machine learning, mathematics, ml infrastructure"
Burro,Machine Learning Internship,"Philadelphia, PA",Internship,Entry-level,Computer Vision,CUDA,Deep Learning,Engineering,GPU,Machine Learning,,,,,,,"Computer Vision, CUDA, Deep Learning, Engineering, GPU, Machine Learning",,"machine learning internship computer vision, cuda, deep learning, engineering, gpu, machine learning"
Publicis Groupe,Digital Data Analyst,"Bogotá, Colombia",Full Time,Entry-level,Data Studio,Excel,Jira,Spark,,,,,,,,,"Data Studio, Excel, Jira, Spark",,"digital data analyst data studio, excel, jira, spark"
Shift Technology,Data Scientist (End-of-studies Internship),France - Paris,Internship,Entry-level,Big Data,Chatbots,Computer Science,Engineering,Machine Learning,Mathematics,Career development,Competitive pay,Equity,,,,"Big Data, Chatbots, Computer Science, Engineering, Machine Learning, Mathematics","Career development, Competitive pay, Equity","data scientist (end-of-studies internship) big data, chatbots, computer science, engineering, machine learning, mathematics"
Outrider,Data Analyst Intern,"Golden, Colorado",Internship,Entry-level,Athena,AWS,Computer Science,Data analysis,Data Analytics,Data visualization,,,,,,,"Athena, AWS, Computer Science, Data analysis, Data Analytics, Data visualization",,"data analyst intern athena, aws, computer science, data analysis, data analytics, data visualization"
Guardant Health,"Bioinformatics Intern, Machine Learning","Palo Alto, CA, United States",Full Time,Entry-level,AWS,Biology,Data analysis,Genetics,Git,GitHub,Career development,Health care,Salary bonus,,,,"AWS, Biology, Data analysis, Genetics, Git, GitHub","Career development, Health care, Salary bonus","bioinformatics intern, machine learning aws, biology, data analysis, genetics, git, github"
Bosch Group,AI/ML Graduate Intern with Focus on AI Engineering,"Mount Prospect, IL, United States",Internship,Entry-level,AWS,Azure,Computer Science,Engineering,GCP,Industrial,,,,,,,"AWS, Azure, Computer Science, Engineering, GCP, Industrial",,"ai/ml graduate intern with focus on ai engineering aws, azure, computer science, engineering, gcp, industrial"
Publicis Groupe,Summer Internship - Data Science / Advanced Analytics,"Los Angeles, CA, United States",Part Time,Entry-level,Excel,R,,,,,Career development,,,,,,"Excel, R",Career development,"summer internship - data science / advanced analytics excel, r"
Fetch,Data Analytics Internship,"Madison, WI",Internship,Entry-level,Data Analytics,Grafana,Python,SQL,Statistics,Tableau,Flex vacation,,,,,,"Data Analytics, Grafana, Python, SQL, Statistics, Tableau",Flex vacation,"data analytics internship data analytics, grafana, python, sql, statistics, tableau"
Vention,Computer vision Developer Intern,"Montréal, QC, Canada",Internship,Entry-level,Computer Vision,Distributed Systems,GPU,JavaScript,Jupyter,Mathematics,Startup environment,,,,,,"Computer Vision, Distributed Systems, GPU, JavaScript, Jupyter, Mathematics",Startup environment,"computer vision developer intern computer vision, distributed systems, gpu, javascript, jupyter, mathematics"
Guardant Health,Machine Learning/Artificial Intelligence Intern,"Palo Alto, CA, United States",Internship,Entry-level,Biology,Computer Science,HPC,Linux,Machine Learning,NLP,Career development,Equity,Health care,,,,"Biology, Computer Science, HPC, Linux, Machine Learning, NLP","Career development, Equity, Health care","machine learning/artificial intelligence intern biology, computer science, hpc, linux, machine learning, nlp"
Bosch Group,"Academic Internship - Deep Learning, Synthetic Data","Braga, Portugal",Internship,Entry-level,Autonomous Driving,Computer Science,Computer Vision,Deep Learning,Lidar,Machine Learning,Career development,Flex hours,,,,,"Autonomous Driving, Computer Science, Computer Vision, Deep Learning, Lidar, Machine Learning","Career development, Flex hours","academic internship - deep learning, synthetic data autonomous driving, computer science, computer vision, deep learning, lidar, machine learning"
Bosch Group,"Academic Internship - Deep Learning, Multi-Task","Braga, Portugal",Internship,Entry-level,Computer Science,Computer Vision,Deep Learning,Lidar,Machine Learning,Physics,Career development,Flex hours,,,,,"Computer Science, Computer Vision, Deep Learning, Lidar, Machine Learning, Physics","Career development, Flex hours","academic internship - deep learning, multi-task computer science, computer vision, deep learning, lidar, machine learning, physics"
Western Digital,"Phd -Interns, Data Scientist","Bengaluru, India",Full Time,Entry-level,Big Data,Computer Science,Data Analytics,Engineering,Machine Learning,PhD,,,,,,,"Big Data, Computer Science, Data Analytics, Engineering, Machine Learning, PhD",,"phd -interns, data scientist big data, computer science, data analytics, engineering, machine learning, phd"
Guardant Health,"Business Application Intern, Machine Learning","Palo Alto, CA, United States",Internship,Entry-level,Architecture,AWS,Computer Science,Engineering,Machine Learning,Privacy,Career development,Equity,Health care,,,,"Architecture, AWS, Computer Science, Engineering, Machine Learning, Privacy","Career development, Equity, Health care","business application intern, machine learning architecture, aws, computer science, engineering, machine learning, privacy"
Snyk,Data Analytics Intern,Boston,Internship,Entry-level,Computer Science,Data Analytics,Looker,Prototyping,Security,SQL,Career development,Flex hours,Flex vacation,,,,"Computer Science, Data Analytics, Looker, Prototyping, Security, SQL","Career development, Flex hours, Flex vacation","data analytics intern computer science, data analytics, looker, prototyping, security, sql"
Publicis Groupe,Data Sciences Intern(Smart's),"Madrid, Spain",Part Time,Entry-level,Data analysis,Economics,Engineering,Mathematics,.NET,RDBMS,Startup environment,,,,,,"Data analysis, Economics, Engineering, Mathematics, .NET, RDBMS",Startup environment,"data sciences intern(smart's) data analysis, economics, engineering, mathematics, .net, rdbms"
CGG,Internship – Machine Learning/MLOps Engineer (6 months),"Massy, France",Full Time,Entry-level,CI/CD,Computer Science,Engineering,HPC,Machine Learning,MLFlow,Career development,Startup environment,,,,,"CI/CD, Computer Science, Engineering, HPC, Machine Learning, MLFlow","Career development, Startup environment","internship – machine learning/mlops engineer (6 months) ci/cd, computer science, engineering, hpc, machine learning, mlflow"
Western Digital,"Intern, Data Engineering (Summer 2023)","San Jose, CA, United States",Internship,Entry-level,AWS,Big Data,Computer Science,Data analysis,Data Analytics,Data pipelines,Career development,Competitive pay,Equity,,,,"AWS, Big Data, Computer Science, Data analysis, Data Analytics, Data pipelines","Career development, Competitive pay, Equity","intern, data engineering (summer 2023) aws, big data, computer science, data analysis, data analytics, data pipelines"
Bosch Group,Internship Embedded AI Engineering,"Reutlingen, Germany",Full Time,Entry-level,Computer Science,Deep Learning,Engineering,Machine Learning,Mathematics,Physics,Career development,,,,,,"Computer Science, Deep Learning, Engineering, Machine Learning, Mathematics, Physics",Career development,"internship embedded ai engineering computer science, deep learning, engineering, machine learning, mathematics, physics"
Rokt,Data Analyst Intern,"New York City, United States",Internship,Entry-level,Agile,Big Data,Business Analytics,Computer Science,Data analysis,E-commerce,Career development,Equity,Home office stipend,,,,"Agile, Big Data, Business Analytics, Computer Science, Data analysis, E-commerce","Career development, Equity, Home office stipend","data analyst intern agile, big data, business analytics, computer science, data analysis, e-commerce"
Shippeo,Data Scientist - Internship,"Paris, France",Internship,Entry-level,Classification,Machine Learning,ML models,NumPy,Pandas,Python,,,,,,,"Classification, Machine Learning, ML models, NumPy, Pandas, Python",,"data scientist - internship classification, machine learning, ml models, numpy, pandas, python"
Vention,Computer vision Developer,"Montréal, QC, Canada",Full Time,Entry-level,Computer Vision,Distributed Systems,GPU,JavaScript,Jupyter,Mathematics,Startup environment,,,,,,"Computer Vision, Distributed Systems, GPU, JavaScript, Jupyter, Mathematics",Startup environment,"computer vision developer computer vision, distributed systems, gpu, javascript, jupyter, mathematics"
CleverConnect,Data Engineer / Data Analyst - Stage de fin d'études - Paris 2e,"Paris, France",Full Time,Entry-level,Agile,Architecture,AWS,BigQuery,Dataflow,Data visualization,Career development,Yoga,,,,,"Agile, Architecture, AWS, BigQuery, Dataflow, Data visualization","Career development, Yoga","data engineer / data analyst - stage de fin d'études - paris 2e agile, architecture, aws, bigquery, dataflow, data visualization"
Abarca Health,"Intern, Data Engineer",Remote,Internship,Entry-level,Business Intelligence,Computer Science,ELT,Engineering,Healthcare technology,Snowflake,Flex hours,Health care,,,,,"Business Intelligence, Computer Science, ELT, Engineering, Healthcare technology, Snowflake","Flex hours, Health care","intern, data engineer business intelligence, computer science, elt, engineering, healthcare technology, snowflake"
Frazer-Nash Consultancy,Data Science and Systems Engineers - Summer Intern 2023,"UK, Great Britain, United Kingdom",Internship,Entry-level,Agile,Computer Science,Consulting,Engineering,Excel,Mathematics,Career development,Competitive pay,Flex hours,,,,"Agile, Computer Science, Consulting, Engineering, Excel, Mathematics","Career development, Competitive pay, Flex hours","data science and systems engineers - summer intern 2023 agile, computer science, consulting, engineering, excel, mathematics"
Plume Labs,AI Engineer Internship,"Paris, Île-de-France, France - Remote",Internship,Entry-level,Agile,APIs,Deep Learning,Keras,Machine Learning,NumPy,Career development,Flex hours,Startup environment,,,,"Agile, APIs, Deep Learning, Keras, Machine Learning, NumPy","Career development, Flex hours, Startup environment","ai engineer internship agile, apis, deep learning, keras, machine learning, numpy"
Lyft,Canada - Early Talent - Supply Chain Data Analyst Intern (Summer 2023),"Montreal, Canada",Internship,Entry-level,Business Analytics,Data analysis,Excel,Jira,Power BI,SQL,Health care,,,,,,"Business Analytics, Data analysis, Excel, Jira, Power BI, SQL",Health care,"canada - early talent - supply chain data analyst intern (summer 2023) business analytics, data analysis, excel, jira, power bi, sql"
Metropolis,Machine Learning Engineer Intern,"Seattle, WA or Santa Monica, CA",Internship,Entry-level,Architecture,Computer Vision,CUDA,cuDNN,Deep Learning,DenseNet,Startup environment,,,,,,"Architecture, Computer Vision, CUDA, cuDNN, Deep Learning, DenseNet",Startup environment,"machine learning engineer intern architecture, computer vision, cuda, cudnn, deep learning, densenet"
BenevolentAI,AI Scientist Internship,"London, England, United Kingdom",Internship,Entry-level,Architecture,Biology,Chemistry,Computer Science,Deep Learning,Drug discovery,Career development,Health care,,,,,"Architecture, Biology, Chemistry, Computer Science, Deep Learning, Drug discovery","Career development, Health care","ai scientist internship architecture, biology, chemistry, computer science, deep learning, drug discovery"
Netcetera,"Spring Internship Program - Machine Learning Engineer (Skopje, Bitola, Ohrid)","Skopje, Greater Skopje, North Macedonia",Internship,Entry-level,Computer Science,Computer Vision,Deep Learning,Machine Learning,NLP,NumPy,Career development,Conferences,Flex hours,,,,"Computer Science, Computer Vision, Deep Learning, Machine Learning, NLP, NumPy","Career development, Conferences, Flex hours","spring internship program - machine learning engineer (skopje, bitola, ohrid) computer science, computer vision, deep learning, machine learning, nlp, numpy"
Ubisoft,Stagiaire Data Analyst (F/H/NB),"Bordeaux, France",Full Time,Entry-level,Airflow,ETL,Git,Hadoop,PySpark,Python,,,,,,,"Airflow, ETL, Git, Hadoop, PySpark, Python",,"stagiaire data analyst (f/h/nb) airflow, etl, git, hadoop, pyspark, python"
Etsy,Data Science Intern,"Brooklyn, NY, United States",Full Time,Entry-level,Computer Vision,Data Mining,Deep Learning,Diffusion models,E-commerce,ICLR,Career development,Conferences,Equity,,,,"Computer Vision, Data Mining, Deep Learning, Diffusion models, E-commerce, ICLR","Career development, Conferences, Equity","data science intern computer vision, data mining, deep learning, diffusion models, e-commerce, iclr"
BenevolentAI,Bioinformatics Data Scientist Internship,"London, England, United Kingdom",Internship,Entry-level,Biology,Causal inference,Data Analytics,Data pipelines,Drug discovery,Engineering,Career development,,,,,,"Biology, Causal inference, Data Analytics, Data pipelines, Drug discovery, Engineering",Career development,"bioinformatics data scientist internship biology, causal inference, data analytics, data pipelines, drug discovery, engineering"
Vitol,Data Science Intern,"London, United Kingdom",Full Time,Entry-level,APIs,Architecture,Data analysis,Power BI,Python,SQL,,,,,,,"APIs, Architecture, Data analysis, Power BI, Python, SQL",,"data science intern apis, architecture, data analysis, power bi, python, sql"
BenevolentAI,Data Scientist Internship,"London, England, United Kingdom",Internship,Entry-level,Biology,Data analysis,Data quality,Drug discovery,Jupyter,Machine Learning,Career development,,,,,,"Biology, Data analysis, Data quality, Drug discovery, Jupyter, Machine Learning",Career development,"data scientist internship biology, data analysis, data quality, drug discovery, jupyter, machine learning"
Trust Lab,Data Science Intern | Greece,Remotely,Internship,Entry-level,Computer Science,Data analysis,Data Analytics,Data Studio,Engineering,Machine Learning,Career development,Competitive pay,Equity,,,,"Computer Science, Data analysis, Data Analytics, Data Studio, Engineering, Machine Learning","Career development, Competitive pay, Equity","data science intern | greece computer science, data analysis, data analytics, data studio, engineering, machine learning"
Spotify,"Summer Internship, Data Scientist | Content Business (US)",New York City,Internship,Entry-level,Computer Science,Economics,Machine Learning,Mathematics,ML models,PhD,Career development,,,,,,"Computer Science, Economics, Machine Learning, Mathematics, ML models, PhD",Career development,"summer internship, data scientist | content business (us) computer science, economics, machine learning, mathematics, ml models, phd"
Sia Partners,Stage de fin d'études - Consultant(e) Data Management,"Paris, France",Full Time,Entry-level,APIs,Architecture,AWS,Azure,Big Data,Business Intelligence,,,,,,,"APIs, Architecture, AWS, Azure, Big Data, Business Intelligence",,"stage de fin d'études - consultant(e) data management apis, architecture, aws, azure, big data, business intelligence"
FarmWise,Machine Learning Intern,"Paris, France (Hybrid)",Internship,Entry-level,AWS,Computer Vision,Deep Learning,GCP,Git,GPU,,,,,,,"AWS, Computer Vision, Deep Learning, GCP, Git, GPU",,"machine learning intern aws, computer vision, deep learning, gcp, git, gpu"
Spotify,"Summer Internship, Machine Learning Engineer Intern | Platform Mission (US)",New York City,Internship,Entry-level,A/B testing,Agile,Cassandra,Classification,Data quality,Flink,Career development,Home office stipend,,,,,"A/B testing, Agile, Cassandra, Classification, Data quality, Flink","Career development, Home office stipend","summer internship, machine learning engineer intern | platform mission (us) a/b testing, agile, cassandra, classification, data quality, flink"
AccuWeather,Data Developer Intern,"Remote or State College, PA",Internship,Entry-level,DataOps,,,,,,,,,,,,DataOps,,data developer intern dataops
Strava,Machine Learning Engineering Intern,Remote (USA),Internship,Entry-level,Computer Science,Data Mining,Data pipelines,Deep Learning,Engineering,Hadoop,Career development,Health care,Team events,,,,"Computer Science, Data Mining, Data pipelines, Deep Learning, Engineering, Hadoop","Career development, Health care, Team events","machine learning engineering intern computer science, data mining, data pipelines, deep learning, engineering, hadoop"
GRESB,Climate Data Analyst - Intern (Asset Impact) | Paris or Berlin,"Paris, Île-de-France, France",Internship,Entry-level,Data analysis,Excel,Finance,Python,R,RDBMS,Career development,,,,,,"Data analysis, Excel, Finance, Python, R, RDBMS",Career development,"climate data analyst - intern (asset impact) | paris or berlin data analysis, excel, finance, python, r, rdbms"
Roblox,Data Science Intern - Causal Inference with Network Interference (Summer 2023),"San Mateo, CA, United States",Internship,Entry-level,Airflow,Big Data,Causal inference,Computer Science,Economics,Engineering,Career development,Equity,Flex hours,,,,"Airflow, Big Data, Causal inference, Computer Science, Economics, Engineering","Career development, Equity, Flex hours","data science intern - causal inference with network interference (summer 2023) airflow, big data, causal inference, computer science, economics, engineering"
Trigo,STAGE - Data Analyst POWER BI - H/F,"Nanterre, France",Full Time,Entry-level,Excel,Power BI,Robotics,RPA,SharePoint,,,,,,,,"Excel, Power BI, Robotics, RPA, SharePoint",,"stage - data analyst power bi - h/f excel, power bi, robotics, rpa, sharepoint"
Santen,Data Science Intern,"Emeryville, CA, United States",Full Time,Entry-level,Data analysis,R,SAS,Statistics,,,Flex hours,Startup environment,Team events,,,,"Data analysis, R, SAS, Statistics","Flex hours, Startup environment, Team events","data science intern data analysis, r, sas, statistics"
Spotify,"Summer Internship, Analytics Engineer | Content Business (US)",New York City,Internship,Entry-level,APIs,BigQuery,Computer Science,Engineering,ETL,PhD,Home office stipend,Startup environment,,,,,"APIs, BigQuery, Computer Science, Engineering, ETL, PhD","Home office stipend, Startup environment","summer internship, analytics engineer | content business (us) apis, bigquery, computer science, engineering, etl, phd"
Spotlab,Artificial Intelligence Research Internship,"Madrid, Spain",Internship,Entry-level,Caffe,Computer Science,Computer Vision,Deep Learning,Engineering,Keras,Career development,Health care,Startup environment,,,,"Caffe, Computer Science, Computer Vision, Deep Learning, Engineering, Keras","Career development, Health care, Startup environment","artificial intelligence research internship caffe, computer science, computer vision, deep learning, engineering, keras"
Fetch,Data Analytics Internship,"Birmingham, AL",Internship,Entry-level,Data Analytics,Grafana,Python,SQL,Statistics,Tableau,Flex vacation,,,,,,"Data Analytics, Grafana, Python, SQL, Statistics, Tableau",Flex vacation,"data analytics internship data analytics, grafana, python, sql, statistics, tableau"
Sayari,Data Engineer Intern,United States - Remote,Internship,Entry-level,Airflow,AWS,Azure,Engineering,ETL,GCP,401(k) matching,Career development,Competitive pay,,,,"Airflow, AWS, Azure, Engineering, ETL, GCP","401(k) matching, Career development, Competitive pay","data engineer intern airflow, aws, azure, engineering, etl, gcp"
Spot AI,Data Analytics Engineer (Intern),"Hayward, California, United States",Internship,Entry-level,APIs,AWS,BigQuery,Computer Science,Data Analytics,Databricks,Career development,,,,,,"APIs, AWS, BigQuery, Computer Science, Data Analytics, Databricks",Career development,"data analytics engineer (intern) apis, aws, bigquery, computer science, data analytics, databricks"
Gameloft,Data Analyst Intern - Summer 2023,"Toronto, ON, Canada",Internship,Entry-level,Computer Science,Data visualization,Mathematics,SQL,Statistics,,Career development,Flex hours,Flex vacation,,,,"Computer Science, Data visualization, Mathematics, SQL, Statistics","Career development, Flex hours, Flex vacation","data analyst intern - summer 2023 computer science, data visualization, mathematics, sql, statistics"
